Lesson,Subject,Description,Hours,Strand,Schedule,Requirement
Kahulugan ng Pagbasa,Filipino,Nauunawaan ang kahalagahan at layunin ng pagbasa,2,STEM,Week 1,1 Seatwork
Uri ng Teksto,Filipino,Nakikilala ang iba't ibang uri ng teksto at layunin ng bawat isa,3,STEM,Week 2,1 Quiz
Pagsusuri ng Akda,Filipino,Nasusuri ang nilalaman at pananaw sa isang akda,3,STEM,Week 3,1 Groupwork
Pag-unawa sa Konteksto,Filipino,Nauunawaan ang kahalagahan ng konteksto sa pagbasa ng teksto,2,STEM,Week 4,1 Seatwork
Paglalapat ng Pagbabasa at Pananaliksik,Filipino,Nagagamit ang kasanayan sa pagbasa sa paggawa ng pananaliksik,3,STEM,Week 5,Final Output
