Lesson,Subject,Description,Hours,Strand,Schedule,Requirement
Kahulugan at Kahalagahan ng Pananaliksik,Filipino,Nauunawaan ang kahalagahan ng pananaliksik sa iba't ibang larangan,3,ABM,Week 1,1 Seatwork
Paksa at Suliranin ng Pananaliksik,Filipino,Nakabubuo ng paksa at suliraning pananaliksik,3,ABM,Week 2,1 Quiz
Pangangalap ng Datos,Filipino,Natatalakay ang mga paraan ng pangangalap ng datos,2,ABM,Week 3,1 Report
Pagsusuri at Interpretasyon ng Datos,Filipino,Naiuugnay ang datos sa layunin ng pananaliksik,3,ABM,Week 4,1 Seatwork
Pagsulat ng Ulat Pananaliksik,Filipino,Nakabubuo ng maayos na ulat pananaliksik sa Filipino,3,ABM,Week 5,Final Output
