Lesson,Subject,Description,Hours,Strand,Schedule,Requirement
Introduction to Earth Science,Science,Understanding the structure and composition of the Earth,3,STEM,Week 1,1 Seatwork
Life Processes,Science,Learning the basic functions of living organisms,3,STEM,Week 2-3,2 Seatworks
Ecosystems,Science,Exploring the interdependence of organisms and environment,3,STEM,Week 4,1 Groupwork
Natural Disasters,Science,Studying causes and effects of natural hazards,3,STEM,Week 5,1 Quiz
Sustainability and Conservation,Science,Promoting environmental awareness and resource management,3,STEM,Week 6,Final Poster Output
